{
  "$schema": "https://json-schema.org/draft/2020-12/schema",
  "type": "object",
  "properties": {
    "uid": {
      "type": "string",
      "pattern": "^(resource-|template-).*"
    },
    "type": {
      "type": "string",
      "enum": [
        "resource",
        "template"
      ]
    },
    "version": {
      "type": "string",
      "pattern": "(0-9)*.(0-9)*.(0-9)*."
    },
    "status": {
      "type": "string",
      "enum": [
        "published",
        "requested"
      ]
    },
    "name": {
      "type": "string"
    },
    "description": {
      "type": "string",
      "maxLength": 250
    },
    "labels": {
      "type": "array",
      "items": [
        {
          "type": "string"
        }
      ]
    },
    "display": {
      "type": "object",
      "properties": {
        "imageUrl": {
          "type": "string",
          "format": "uri"
        },
        "color": {
          "type": "string",
          "format": "hexcolor"
        }
      },
      "required": [
        "imageUrl"
      ]
    },
    "links": {
      "type": "array",
      "items": [
        {
          "type": "object",
          "properties": {
            "rel": {
              "type": "string"
            },
            "href": {
              "type": "string",
              "format": "uri"
            },
            "title": {
              "type": "string"
            },
            "type": {
              "type": "string"
            }
          },
          "required": [
            "rel",
            "href"
          ]
        }
      ]
    },
    "schema": {
      "type": "array",
      "items": {}
    },
    "item": {
      "type": "object",
      "properties": {}
    }
  }
}