{
  "uid": "resource-http-discord",
  "type": "resource",
  "status": "published",
  "name": "Discord",
  "description": "Resource for the Discord API",
  "labels": [
    "social",
    "communications"
  ],
  "display": {
    "imageUrl": "https://raw.githubusercontent.com/netzo/netzo/main/packages/resources/resource-http-discord/icon.webp"
  },
  "links": [
    {
      "rel": "repository",
      "href": "https://github.com/netzo/netzo/tree/main/packages/resources/resource-http-discord"
    },
    {
      "rel": "readme",
      "href": "https://raw.githubusercontent.com/netzo/netzo/main/packages/resources/resource-http-discord/src/readme.md"
    }
  ],
  "item": {
    "_type": "resource",
    "type": "http",
    "base": {
      "baseURL": "https://discord.com/api/v10",
      "headers": {
        "Content-Type": "application/json"
      },
      "authorization": {
        "type": "apiKey",
        "in": "header",
        "name": "Authorization",
        "value": "{{tokenType}} {{token}}"
      }
    }
  }
}