{
  "uid": "resource-http-purpleair",
  "type": "resource",
  "status": "published",
  "name": "PurpleAir",
  "description": "Resource for the PurpleAir API",
  "labels": [
    "iot",
    "environmental"
  ],
  "display": {
    "imageUrl": "https://raw.githubusercontent.com/netzo/netzo/main/packages/resources/resource-http-purpleair/icon.webp"
  },
  "links": [
    {
      "rel": "repository",
      "href": "https://github.com/netzo/netzo/tree/main/packages/resources/resource-http-purpleair"
    },
    {
      "rel": "readme",
      "href": "https://raw.githubusercontent.com/netzo/netzo/main/packages/resources/resource-http-purpleair/src/readme.md"
    }
  ],
  "schema": [
    {
      "component": "v-text-field",
      "name": "apiKey",
      "label": "API Key"
    }
  ],
  "item": {
    "_type": "resource",
    "type": "http",
    "base": {
      "baseURL": "https://api.purpleair.com/v1",
      "headers": {
        "Content-Type": "application/json"
      },
      "authorization": {
        "type": "apiKey",
        "in": "header",
        "name": "X-API-Key",
        "value": "{{apiKey}}"
      }
    }
  }
}