{
  "uid": "resource-http-netzo",
  "type": "resource",
  "status": "published",
  "name": "Netzo",
  "description": "Resource for the Netzo API",
  "labels": [
    "infrastructure",
    "integrations",
    "admin"
  ],
  "display": {
    "imageUrl": "https://raw.githubusercontent.com/netzo/netzo/main/packages/resources/resource-http-netzo/icon.webp"
  },
  "links": [
    {
      "rel": "repository",
      "href": "https://github.com/netzo/netzo/tree/main/packages/resources/resource-http-netzo"
    },
    {
      "rel": "readme",
      "href": "https://raw.githubusercontent.com/netzo/netzo/main/packages/resources/resource-http-netzo/src/readme.md"
    }
  ],
  "schema": [
    {
      "component": "v-text-field",
      "name": "apiKey",
      "label": "API Key"
    }
  ],
  "item": {
    "_type": "resource",
    "type": "http",
    "base": {
      "baseURL": "https://api.netzo.io",
      "headers": {
        "Content-Type": "application/json"
      },
      "authorization": {
        "type": "apiKey",
        "in": "header",
        "name": "x-api-key",
        "value": "{{apiKey}}"
      }
    }
  }
}