{
  "uid": "resource-http-enphase",
  "type": "resource",
  "status": "requested",
  "name": "Enphase",
  "description": "Resource for the Enphase API",
  "labels": [
    "iot",
    "energy",
    "solar"
  ],
  "display": {
    "imageUrl": "https://raw.githubusercontent.com/netzo/netzo/main/packages/resources/resource-http-enphase/icon.webp"
  },
  "links": [
    {
      "rel": "repository",
      "href": "https://github.com/netzo/netzo/tree/main/packages/resources/resource-http-enphase"
    },
    {
      "rel": "readme",
      "href": "https://raw.githubusercontent.com/netzo/netzo/main/packages/resources/resource-http-enphase/src/readme.md"
    }
  ],
  "item": {
    "_type": "resource",
    "type": "http",
    "base": {
      "baseURL": "https://api.enphaseenergy.com/api/v4",
      "headers": {
        "Content-Type": "application/json"
      },
      "authorization": {
        "type": "oauth2",
        "clientId": "{{clientId}}",
        "clientSecret": "{{clientSecret}}",
        "authorizationURL": "{{authorizationURL}}",
        "accessTokenURL": "{{accessTokenURL}}",
        "redirectURL": "{{redirectURL}}",
        "scopes": "{{scopes}}"
      }
    }
  }
}