{
  "uid": "resource-http-netzo-echo",
  "type": "resource",
  "status": "published",
  "name": "Netzo Echo",
  "description": "Resource for the Netzo Echo API (echoes back requests)",
  "labels": [
    "mock",
    "utility"
  ],
  "display": {
    "imageUrl": "https://raw.githubusercontent.com/netzo/netzo/main/packages/resources/resource-http-netzo-echo/icon.webp"
  },
  "links": [
    {
      "rel": "repository",
      "href": "https://github.com/netzo/netzo/tree/main/packages/resources/resource-http-netzo-echo"
    },
    {
      "rel": "readme",
      "href": "https://raw.githubusercontent.com/netzo/netzo/main/packages/resources/resource-http-netzo-echo/src/readme.md"
    }
  ],
  "item": {
    "_type": "resource",
    "type": "http",
    "base": {
      "baseURL": "https://echo.netzo.io",
      "headers": {},
      "authorization": {}
    }
  }
}