{
  "uid": "template-framework-ultrajs",
  "type": "template",
  "version": "1.0.0",
  "status": "published",
  "name": "UltraJS",
  "description": "A basic starter template using the UltraJS library",
  "labels": [
    "framework"
  ],
  "display": {
    "imageUrl": "https://raw.githubusercontent.com/netzo/netzo/main/packages/templates/template-framework-ultrajs/icon.svg"
  },
  "links": [
    {
      "rel": "author",
      "href": "https://netzo.io",
      "title": "Netzo"
    },
    {
      "rel": "repository",
      "href": "https://github.com/netzo/netzo/tree/main/packages/templates/template-framework-ultrajs"
    },
    {
      "rel": "readme",
      "href": "https://raw.githubusercontent.com/netzo/netzo/main/packages/templates/template-framework-ultrajs/src/readme.md"
    }
  ],
  "schema": [],
  "item": {
    "_type": "project",
    "fs": {
      "readme.md": {
        "url": "https://raw.githubusercontent.com/netzo/netzo/main/packages/templates/template-framework-ultrajs/src/readme.md"
      },
      "deno.jsonc": {
        "url": "https://raw.githubusercontent.com/netzo/netzo/main/packages/templates/template-framework-ultrajs/src/deno.jsonc"
      },
      "app.tsx": {
        "url": "https://raw.githubusercontent.com/netzo/netzo/main/packages/templates/template-framework-ultrajs/src/app.tss"
      },
      "server.tsx": {
        "url": "https://raw.githubusercontent.com/netzo/netzo/main/packages/templates/template-framework-ultrajs/src/server.tsx"
      }
    },
    "configuration": {
      "entrypoint": "server.tsx",
      "envs": {},
      "permissions": {
        "net": true
      }
    }
  }
}