{
  "uid": "resource-http-hashnode",
  "type": "resource",
  "version": "1.0.0",
  "status": "requested",
  "name": "Hashnode",
  "description": "Resource for the Hashnode API",
  "labels": [
    "social",
    "blog"
  ],
  "display": {
    "imageUrl": "https://raw.githubusercontent.com/netzo/netzo/main/packages/resources/resource-http-hashnode/icon.webp"
  },
  "links": [
    {
      "rel": "repository",
      "href": "https://github.com/netzo/netzo/tree/main/packages/resources/resource-http-hashnode"
    },
    {
      "rel": "readme",
      "href": "https://raw.githubusercontent.com/netzo/netzo/main/packages/resources/resource-http-hashnode/src/readme.md"
    }
  ],
  "schema": [
    {
      "component": "v-text-field",
      "name": "apiKey",
      "label": "API Key"
    }
  ],
  "item": {
    "_type": "resource",
    "type": "http",
    "base": {
      "baseURL": "https://hashnode.typicode.com",
      "headers": {
        "Content-Type": "application/json"
      },
      "authorization": {
        "type": "apiKey",
        "in": "header",
        "name": "Authorization",
        "value": "{{apiKey}}"
      }
    }
  }
}