{
  "uid": "template-framework-oak",
  "type": "template",
  "version": "1.0.0",
  "status": "published",
  "name": "Oak",
  "description": "An HTTP server using router to handle POST and GET requests separately. Router by denosaurs is a tiny router framework for Deno Deploy. It can route based on method, route, and has customizable handlers for cases such as no match, errors, or unknown methods.",
  "labels": [
    "framework"
  ],
  "display": {
    "imageUrl": "https://raw.githubusercontent.com/netzo/netzo/main/packages/templates/template-framework-oak/icon.webp"
  },
  "links": [
    {
      "rel": "author",
      "href": "https://netzo.io",
      "title": "Netzo"
    },
    {
      "rel": "repository",
      "href": "https://github.com/netzo/netzo/tree/main/packages/templates/template-framework-oak"
    },
    {
      "rel": "readme",
      "href": "https://raw.githubusercontent.com/netzo/netzo/main/packages/templates/template-framework-oak/src/readme.md"
    }
  ],
  "schema": [],
  "item": {
    "_type": "project",
    "fs": {
      "readme.md": {
        "url": "https://raw.githubusercontent.com/netzo/netzo/main/packages/templates/template-framework-oak/src/readme.md"
      },
      "deno.jsonc": {
        "url": "https://raw.githubusercontent.com/netzo/netzo/main/packages/templates/template-framework-oak/src/deno.jsonc"
      },
      "main.ts": {
        "url": "https://raw.githubusercontent.com/netzo/netzo/main/packages/templates/template-framework-oak/src/main.ts"
      }
    },
    "configuration": {
      "entrypoint": "main.ts",
      "envs": {},
      "permissions": {
        "net": true
      }
    }
  }
}