{
  "uid": "resource-http-facturama",
  "type": "resource",
  "status": "published",
  "name": "Facturama",
  "description": "Resource for the Facturama API",
  "labels": [
    "billing"
  ],
  "display": {
    "imageUrl": "https://raw.githubusercontent.com/netzo/netzo/main/packages/resources/resource-http-facturama/icon.webp"
  },
  "links": [
    {
      "rel": "repository",
      "href": "https://github.com/netzo/netzo/tree/main/packages/resources/resource-http-facturama"
    },
    {
      "rel": "readme",
      "href": "https://raw.githubusercontent.com/netzo/netzo/main/packages/resources/resource-http-facturama/src/readme.md"
    }
  ],
  "item": {
    "_type": "resource",
    "type": "http",
    "base": {
      "baseURL": "https://api.facturama.mx",
      "headers": {},
      "basic": {
        "type": "basic",
        "username": "{{username}}",
        "password": "{{password}}"
      }
    }
  }
}