{
  "uid": "resource-http-rappi",
  "type": "resource",
  "status": "requested",
  "name": "Rappi",
  "description": "Rappi is an application for ordering food and other products from local stores.",
  "labels": [
    "delivery"
  ],
  "display": {
    "imageUrl": "https://raw.githubusercontent.com/netzo/netzo/main/packages/resources/resource-http-rappi/icon.webp"
  },
  "links": [
    {
      "rel": "repository",
      "href": "https://github.com/netzo/netzo/tree/main/packages/resources/resource-http-rappi"
    },
    {
      "rel": "readme",
      "href": "https://raw.githubusercontent.com/netzo/netzo/main/packages/resources/resource-http-rappi/src/readme.md"
    }
  ],
  "schema": [
    {
      "component": "v-text-field",
      "name": "clientId",
      "label": "Client ID"
    },
    {
      "component": "v-text-field",
      "name": "clientSecret",
      "label": "Client Secret"
    },
    {
      "component": "v-text-field",
      "name": "authorizationURL",
      "label": "Authorization URL"
    },
    {
      "component": "v-text-field",
      "name": "accessTokenURL",
      "label": "Access Token URL"
    },
    {
      "component": "v-text-field",
      "name": "redirectURL",
      "label": "Redirect URL"
    },
    {
      "component": "v-combobox",
      "name": "scopes",
      "label": "Scopes",
      "chips": true,
      "multiple": true
    }
  ],
  "item": {
    "_type": "resource",
    "type": "http",
    "base": {
      "baseURL": "https://api.rappi.com/2",
      "headers": {
        "Content-Type": "application/json"
      },
      "authorization": {
        "type": "oauth2",
        "clientId": "{{clientId}}",
        "clientSecret": "{{clientSecret}}",
        "authorizationURL": "{{authorizationURL}}",
        "accessTokenURL": "{{accessTokenURL}}",
        "redirectURL": "{{redirectURL}}",
        "scopes": "{{scopes}}"
      }
    }
  }
}