{
  "uid": "resource-http-sendgrid",
  "type": "resource",
  "status": "published",
  "name": "Sendgrid",
  "description": "Resource for the Sendgrid API",
  "labels": [
    "transactional",
    "communications"
  ],
  "display": {
    "imageUrl": "https://raw.githubusercontent.com/netzo/netzo/main/packages/resources/resource-http-sendgrid/icon.webp"
  },
  "links": [
    {
      "rel": "repository",
      "href": "https://github.com/netzo/netzo/tree/main/packages/resources/resource-http-sendgrid"
    },
    {
      "rel": "readme",
      "href": "https://raw.githubusercontent.com/netzo/netzo/main/packages/resources/resource-http-sendgrid/src/readme.md"
    }
  ],
  "item": {
    "_type": "resource",
    "type": "http",
    "base": {
      "baseURL": "https://api.sendgrid.com/v3",
      "headers": {
        "Content-Type": "application/json"
      },
      "authorization": {
        "type": "apiKey",
        "in": "header",
        "name": "Authorization",
        "value": "Bearer {{apiKey}}"
      }
    }
  }
}