{
  "uid": "resource-http-activecampaign",
  "type": "resource",
  "status": "published",
  "name": "ActiveCampaign",
  "description": "Resource for the ActiveCampaign API",
  "labels": [
    "crm",
    "marketing"
  ],
  "display": {
    "imageUrl": "https://raw.githubusercontent.com/netzo/netzo/main/packages/resources/resource-http-activecampaign/icon.webp"
  },
  "links": [
    {
      "rel": "repository",
      "href": "https://github.com/netzo/netzo/tree/main/packages/resources/resource-http-activecampaign"
    },
    {
      "rel": "readme",
      "href": "https://raw.githubusercontent.com/netzo/netzo/main/packages/resources/resource-http-activecampaign/src/readme.md"
    }
  ],
  "item": {
    "_type": "resource",
    "type": "http",
    "base": {
      "baseURL": "https://{{accountName}}.api-us1.com/api/3",
      "headers": {
        "Content-Type": "application/json"
      },
      "authorization": {
        "type": "apiKey",
        "in": "header",
        "name": "Api-Token",
        "value": "{{apiKey}}"
      }
    }
  }
}