{
  "uid": "resource-http-sugarcrm",
  "type": "resource",
  "version": "1.0.0",
  "status": "requested",
  "name": "SugarCRM",
  "description": "Resource for the SugarCRM API",
  "labels": [
    "crm"
  ],
  "display": {
    "imageUrl": "https://raw.githubusercontent.com/netzo/netzo/main/packages/resources/resource-http-sugarcrm/icon.webp"
  },
  "links": [
    {
      "rel": "repository",
      "href": "https://github.com/netzo/netzo/tree/main/packages/resources/resource-http-sugarcrm"
    },
    {
      "rel": "readme",
      "href": "https://raw.githubusercontent.com/netzo/netzo/main/packages/resources/resource-http-sugarcrm/src/readme.md"
    }
  ],
  "schema": [
    {
      "component": "v-text-field",
      "name": "baseURL",
      "label": "Base URL",
      "hint": "Replace {{siteURL}} with corresponding value",
      "default": "https://{{siteURL}}/rest/v11_17"
    },
    {
      "component": "v-text-field",
      "name": "clientId",
      "label": "Client ID"
    },
    {
      "component": "v-text-field",
      "name": "clientSecret",
      "label": "Client Secret"
    },
    {
      "component": "v-text-field",
      "name": "authorizationURL",
      "label": "Authorization URL"
    },
    {
      "component": "v-text-field",
      "name": "accessTokenURL",
      "label": "Access Token URL"
    },
    {
      "component": "v-text-field",
      "name": "redirectURL",
      "label": "Redirect URL"
    },
    {
      "component": "v-combobox",
      "name": "scopes",
      "label": "Scopes",
      "chips": true,
      "multiple": true
    }
  ],
  "item": {
    "_type": "resource",
    "type": "http",
    "base": {
      "baseURL": "{{baseURL}}",
      "headers": {
        "Content-Type": "application/json"
      },
      "authorization": {
        "type": "oauth2",
        "clientId": "{{clientId}}",
        "clientSecret": "{{clientSecret}}",
        "authorizationURL": "{{authorizationURL}}",
        "accessTokenURL": "{{accessTokenURL}}",
        "redirectURL": "{{redirectURL}}",
        "scopes": "{{scopes}}"
      }
    }
  }
}